title,link,description,source_time,timestamp
The path ahead with artificial intelligence,https://www.telenor.com/insights/creating-the-future/the-path-ahead-with-artificial-intelligence/,"One way Telenor will address concerns is through investments in research 
within the domain of responsible AI, which aims to create systems 
understood and...",01-Jan-2024,N/A
Welcome to the era of AI nationalism,https://www.economist.com/business/2024/01/01/welcome-to-the-era-of-ai-nationalism,"It is natural for countries to want some control over what may prove to be 
a transformational technology. Especially in sensitive and highly regulated 
sectors...",01-Jan-2024,N/A
"AI Governance in the Age of Uncertainty: International Law as a Starting 
Point",https://www.justsecurity.org/90903/ai-governance-in-the-age-of-uncertainty-international-law-as-a-starting-point/,"AI does not exist in a legal vacuum and, as noted earlier, general 
protections and prohibitions under international law are still relevant. 
Before deciding...",02-Jan-2024,N/A
"AI can now attend a meeting and write code for you – here's why you should 
be cautious",https://theconversation.com/ai-can-now-attend-a-meeting-and-write-code-for-you-heres-why-you-should-be-cautious-217733,"Copilot can summarise verbal conversations on Teams online meetings, 
present arguments for or against a particular point based on verbal 
discussions and answer...",02-Jan-2024,N/A
The (Very) Emerging Role Of AI In The Accounting Industry,https://www.forbes.com/sites/quickerbettertech/2024/01/01/the-very-emerging-role-of-ai-in-the-accounting-industry/,"The profession's biggest firms - like EY and PwC - are deploying AI 
technology in their auditing and financial review procedures in order to 
identify irregular...",01-Jan-2024,N/A
What psychologists need to know about the evolution of generative AI,https://www.apa.org/monitor/2024/01/trends-generative-ai-evolution-psychology,"Chatbots in therapy. In the clinical sphere, psychologists are also 
proceeding with caution. Generative AI clearly holds potential for 
automating administrative...",01-Jan-2024,N/A
"AI May Not Steal Your Job, but It Could Stop You Getting Hired",https://www.wired.com/story/hilke-schellmann-algorithm-book-ai-jobs-hiring/,"AI May Not Steal Your Job, but It Could Stop You Getting Hired. In her new 
book The Algorithm, journalist Hilke Schellmann investigates software that 
automates...",02-Jan-2024,N/A
Adapting Your Organization for Responsible AI,https://www.bain.com/insights/adapting-your-organization-for-responsible-ai/,"Adapting Your Organization for Responsible AI · An effective approach to 
responsible AI doubles its profit impact · Responsible AI commitments need 
to span the...",02-Jan-2024,N/A
AI could improve your life by removing decision-making bottlenecks,https://www.fastcompany.com/91002501/ai-could-improve-your-life-by-removing-bottlenecks-in-decision-making,"Traditionally, people have been forced to reduce complex choices to a small 
handful of options that don't do justice to their true desires.",02-Jan-2024,N/A
AI-driven projection tomography with multicore fibre-optic cell rotation,https://www.nature.com/articles/s41467-023-44280-1,"This innovation effectively bridges the existing gap between fiber-optic 
manipulation and optical tomography. The core of this system is an 
AI-driven autonomous...",02-Jan-2024,N/A
How AI May Transform Musculoskeletal Imaging | Radiology,https://pubs.rsna.org/doi/10.1148/radiol.230764,"With the ongoing trend of increased imaging prescription and decreased 
acquisition time, a wide variety of artificial intelligence (AI)–based 
tools can improve...",02-Jan-2024,N/A
AI Meets TD,https://www.td.org/magazines/td-magazine/ai-meets-td,"The call to action is clear: Embrace AI, not as a challenge but as an 
opportunity to redefine TD and make learning more personalized, efficient, 
engaging, and...",02-Jan-2024,N/A
Cambridgeshire firms banking on AI for dementia care and drugs,https://www.bbc.com/news/uk-england-cambridgeshire-67264900,"In purpose-built labs, the company is trying to use artificial intelligence 
to make life-saving drugs more affordable and quicker to produce.",02-Jan-2024,N/A
vivo Bets on Generative AI to Elevate the Smartphone Experience,https://www.counterpointresearch.com/insights/vivo-bets-on-generative-ai-to-elevate-the-smartphone-experience/,"During the event, vivo showcased several generative AI applications powered 
by BlueLM. With the vivo X100 or X100 pro, AI can be instructed to write a 
review,...",02-Jan-2024,N/A
4 ways people are using AI for climate change solutions,https://www.npr.org/2024/01/02/1218677963/ai-climate-change-solutions-fires-lithium-methane,"Using AI for early detection of forest fires. Climate change is driving 
more frequent and intense wildfires, and those burns are making up an 
increasing share...",02-Jan-2024,N/A
AIoT Means Alot: The Internet of Things Gets an Artificial Intelligence Jolt,https://www.rtinsights.com/aiot-means-alot-the-internet-of-things-gets-an-artificial-intelligence-jolt/,"Artificial intelligence is converging with the Internet of Things, and the 
result is something called “AIoT.” It means IoT networks and associated 
endpoints may...",02-Jan-2024,N/A
"From The Classroom To The Economy: Northeastern University's Institute For 
Experiential AI Accelerates Real-World AI ...",https://www.forbes.com/sites/randybean/2024/01/02/from-the-classroom-to-the-economy-northeastern-universitys-institute-for-experiential-ai-accelerates-real-world-ai-transformation/,"To deliver on this mandate, EAI is focused on training students on 
real-world applications so that they can add business value from day one. 
The Institute is...",02-Jan-2024,N/A
The AI–quantum computing mash-up: will it revolutionize science?,https://www.nature.com/articles/d41586-023-04007-0,"The AI–quantum computing mash-up: will it revolutionize science? Scientists 
are exploring the potential of quantum machine learning. But whether there 
are...",02-Jan-2024,N/A
People Who Love Learning Win: A Demystifying AI Guide,https://www.forbes.com/sites/soulaimagourani/2024/01/02/people-who-love-learning-win-a-demystifying-ai-guide/,"People Who Love Learning Win: A Demystifying AI Guide · Lay the Foundation 
with AI Basics · Enroll in Beginner-Friendly Online Courses · Acquire 
Basic...",02-Jan-2024,N/A
Where is AI Heading in 2024? Looking Ahead To AI In 2024,https://www.forbes.com/sites/cognitiveworld/2024/01/02/looking-ahead-to-ai-in-2024/,"The combination of AI vendor overhype, increasing regulation, and the 
watering down of generative AI solutions will lead to a more realistic 
perspective on AI...",02-Jan-2024,N/A
Whitepaper:The rise of explainable industrial artificial intelligence,https://www.siemens.com/global/en/products/automation/topic-areas/artificial-intelligence-in-industry/whitepaper-the-rise-of-explainable-industrial-artificial-intelligence.html,"The rise of explainable industrial artificial intelligence (XAI). 
Explainability is becoming an essential component of industrial-grade AI. 
It is necessary...",02-Jan-2024,N/A
How AI is transforming the creative economy and music industry,https://www.ohio.edu/news/2024/04/how-ai-transforming-creative-economy-and-music-industry,"Using AI, musicians and songwriters have the power to generate content in 
seconds, synthesize sound-alike vocals, separate elements on the same track 
and much...",02-Jan-2024,N/A
5 Of The Best AI Presentation Tools To Replace PowerPoint In 2024,https://www.forbes.com/sites/rachelwells/2024/01/02/5-of-the-best-ai-presentation-tools-to-replace-powerpoint-in-2024/,"5 Of The Best AI Presentation Tools To Replace PowerPoint In 2024 · 1. 
Beautiful.ai. Beautiful.ai is a software that enables you to create 
stunning...",02-Jan-2024,N/A
Rise of the AI psychbots - POLITICO,https://www.politico.com/newsletters/digital-future-daily/2024/01/02/rise-of-the-ai-psychbots-00133487,"The Chinese-built virtual Seligman is part of a broader wave of AI chatbots 
modeled on real humans, using the powerful new systems known as large 
language...",02-Jan-2024,N/A
Outside the Box: Will AI Ever Escape from its Box?,https://www.fairobserver.com/business/technology/artificial-intelligence/outside-the-box-will-ai-ever-escape-from-its-box/,"This should demonstrate that AI is a powerful tool, able to recognize and 
assemble a lot of facts and repeat existing ideas because of its access to 
data. But...",02-Jan-2024,N/A
"How to become a generative AI builder, starting at square one | Amazon Web 
Services",https://aws.amazon.com/blogs/training-and-certification/how-to-become-a-generative-ai-builder-starting-at-square-one/,"Amazon SageMaker and AWS Skill Builder are like treasure maps, showing the 
way. The path is exciting, with challenges and triumphs along the way, 
offering the...",02-Jan-2024,N/A
These Princetonians Are Directing the Future of AI Technology,https://paw.princeton.edu/article/these-princetonians-are-directing-future-ai-technology,"At the forefront of the many people working in this field to create 
increasingly impressive, sophisticated, understandable, and ethical AI 
systems and tools,...",02-Jan-2024,N/A
"The creative future of generative AI | MIT News | Massachusetts Institute 
of Technology",https://news.mit.edu/2024/creative-future-generative-ai-0102,"The future of generative AI and its impact on art and design was the 
subject of a sold-out panel discussion at MIT. The panel was co-presented 
by the MIT...",02-Jan-2024,N/A
How to Worry About Artificial Intelligence,https://www.aei.org/op-eds/how-to-worry-about-artificial-intelligence/,"One question it has drawn, both today and when I've made this basic case to 
various people lately, is whether the kind of modest approach I propose 
might be...",02-Jan-2024,N/A
"Supply Chain Predictions 2024: AI, Sustainability Top Of Mind",https://www.forbes.com/sites/sap/2024/01/02/supply-chain-predictions-2024-ai-sustainability-top-of-mind/,"Supply Chain Predictions 2024: AI, Sustainability Top Of Mind · Risk 
Resiliency is here to stay · Sustainability is top of mind · Transparency 
and...",02-Jan-2024,N/A
AI is killing the grand bargain at the heart of the web,https://www.businessinsider.com/ai-killing-web-grand-bargain-2023-8,"AI is killing the grand bargain at the heart of the web. 'We're in a 
different world.' · Content owners are wising up to their work being freely 
used by Big...",02-Jan-2024,N/A
Why Now is the Time to Invest in AI Technology,https://www.nasdaq.com/articles/why-now-is-the-time-to-invest-in-ai-technology,"The investment for AI is multifaceted. Firstly, the expansion of AI 
applications across diverse sectors signifies a tipping point that promises 
long-term value...",02-Jan-2024,N/A
4 AI predictions for 2024,https://www.latimes.com/business/technology/story/2024-01-02/ai-predictions-2024-competency-tests-election-ads-bankruptcies,"Bill Burton, former deputy press secretary for the Obama administration, 
predicted: “The most viewed and engaged videos in the 2024 election are 
generated by AI...",02-Jan-2024,N/A
"Database of 16000 Artists Used to Train Midjourney AI, Including 6-Year-Old 
Child, Garners Criticism",https://www.artnews.com/art-news/news/midjourney-ai-artists-database-1234691955/,"Artists included Warhol, Picasso, Cezanne, van Gogh, Anish Kapoor, Yayoi 
Kusama, Gerhard Richter, Frida Kahlo, and Banksy.",02-Jan-2024,N/A
How copyright law could threaten the AI industry in 2024,https://www.reuters.com/legal/litigation/how-copyright-law-could-threaten-ai-industry-2024-2024-01-02/,"They all argue that tech companies infringe their copyrights by taking and 
reproducing their materials without permission for AI training. The 
plaintiffs are...",02-Jan-2024,N/A
"AI development expected to 'explode' in 2024, experts say",https://www.foxnews.com/us/ai-development-expected-explode-2024-experts-say,"While first steps were taken to regulate the industry in 2023, including a 
Biden administration agreement with leading tech companies to safely 
develop AI tools...",01-Jan-2024,N/A
Texas is exploring role of AI in government,https://www.texastribune.org/2024/01/02/texas-government-artificial-intelligence/,"More than a third of state agencies are using AI. Texas is beginning to 
examine its potential impact. Amid fears that AI could heighten bias or 
affect privacy,...",02-Jan-2024,N/A
Opinion | A.I. Use by Law Enforcement Must Be Strictly Regulated,https://www.nytimes.com/2024/01/02/opinion/ai-police-regulation.html,"Those law enforcement agencies should instead be required to provide 
verifiable evidence that A.I. tools they or their vendors use will not 
cause harm, worsen...",02-Jan-2024,N/A
How AI Can Improve Your Cyber GRC in 2024,https://www.itprotoday.com/ai-machine-learning/how-ai-can-improve-your-cyber-grc-in-2024,"With complex networks, rapidly shifting regulations, and increasing demands 
for proof of compliance, manual workflows can't cut it. AI monitoring, 
remediation,...",02-Jan-2024,N/A
Top 13 IoT blogs to follow in 2024,https://www.techtarget.com/whatis/feature/Top-18-IoT-blogs-to-follow,"The internet of things is driving many of today's most significant 
technology developments. Modern organizations use IoT applications and 
sensors for...",02-Jan-2024,N/A
Court to decide fate of Gen AI under copyright law in 2024,https://www.axios.com/2024/01/02/copyright-law-violation-artificial-intelligence-courts,"Copyright law is AI's 2024 battlefield ... Looming fights over copyright in 
AI are likely to set the new technology's course in 2024 faster than 
legislation or...",02-Jan-2024,N/A
"By Jove, It's No Myth: NVIDIA Triton Accelerates Inference on Oracle Cloud",https://blogs.nvidia.com/blog/ai-inference-oci-triton/,"The cloud giant's computer vision and data science services accelerate AI 
predictions using the NVIDIA Triton Inference Server.",02-Jan-2024,N/A
